{
  "periodStartDate": "2017-04-06",
  "periodEndDate": "2017-05-05",
  "inboundPayments": {
    "newSubsForPeriod": 4000.00,
    "newSubsYTD": 4000.00,
    "totalSubsForPeriod": 4000.00,
    "totalSubsYTD": 4000.00
  },
  "bonuses": {
    "bonusPaidYTD": 0.0,
    "bonusDueForPeriod": 1000.00,
    "totalBonusDueYTD": 1000.00,
    "claimReason": "Regular Bonus"
  }
}